{
  "schema": 1,
  "id": 11,
  "name": "初霜",
  "tagline": "空气里有了凉意",
  "win": {
    "title": "霜中起飞",
    "text": "环境转凉，全域都微微下沉——上升成了昂贵的奢侈品。初霜时节，每一份热量都要精打细算。"
  },
  "world": { "w": 76, "h": 56, "cell": 0.75 },
  "terrain": { "sdf": "48 - 26*ss((x-36)/12) - y" },
  "budget": { "hot": 3, "cold": 1 },
  "spawn": { "x": -6, "y": 33, "vx": 20 },
  "goals": [{ "x": 66, "r": 7.5 }],
  "ambient": { "x": 1.6, "y": 0, "temp": -0.12 }
}
